{
  "$schema": "https://json-schema.org/draft/2020-12/schema",
  "$id": "https://raw.githubusercontent.com/Akshay7273/skill-advisories/main/schema/advisory.schema.json",
  "title": "Skill Advisory",
  "description": "A single security advisory for an AI agent skill, plugin, or MCP server.",
  "type": "object",
  "additionalProperties": false,
  "required": ["schema_version", "id", "type", "summary", "severity", "artifacts", "references", "published", "modified"],
  "properties": {
    "schema_version": { "const": "1" },
    "id": {
      "type": "string",
      "pattern": "^SKA-[0-9]{4}-[0-9]{4}$",
      "description": "SKA-<year>-<sequence>. SKA-<year>-0000 is reserved for tooling tests."
    },
    "aliases": {
      "type": "array",
      "uniqueItems": true,
      "items": { "type": "string", "minLength": 3 }
    },
    "type": { "enum": ["malicious", "vulnerable", "typosquat", "compromised", "test"] },
    "summary": { "type": "string", "minLength": 10, "maxLength": 200 },
    "details": { "type": "string" },
    "severity": { "enum": ["critical", "high", "medium", "low"] },
    "behaviors": {
      "type": "array",
      "uniqueItems": true,
      "items": {
        "enum": ["credential-theft", "data-exfiltration", "backdoor", "malware-dropper", "prompt-injection", "crypto-theft", "spam", "other"]
      }
    },
    "artifacts": {
      "type": "array",
      "minItems": 1,
      "items": {
        "type": "object",
        "additionalProperties": false,
        "required": ["ecosystem", "name"],
        "properties": {
          "ecosystem": { "enum": ["claude-skill", "claude-plugin", "clawhub", "mcp-server", "npm", "pypi", "vscode-extension", "github-action"] },
          "name": { "type": "string", "minLength": 1 },
          "publisher": { "type": "string" },
          "versions": { "type": "array", "uniqueItems": true, "items": { "type": "string" } },
          "sha256": { "type": "array", "uniqueItems": true, "items": { "type": "string", "pattern": "^[a-f0-9]{64}$" } }
        }
      }
    },
    "references": {
      "type": "array",
      "minItems": 1,
      "items": {
        "type": "object",
        "additionalProperties": false,
        "required": ["type", "url"],
        "properties": {
          "type": { "enum": ["REPORT", "ADVISORY", "ARTICLE", "WEB"] },
          "url": { "type": "string", "format": "uri" }
        }
      }
    },
    "credits": { "type": "array", "items": { "type": "string" } },
    "published": { "type": "string", "format": "date-time" },
    "modified": { "type": "string", "format": "date-time" },
    "withdrawn": { "type": "string", "format": "date-time" }
  }
}
